youtube_id,top_rank,n_hits,title,duration,deviation,salami_coverage,decision,in_top_5,in_top_10,same_plus_5,same_less_5,overall_score,matching_length,onset_in_youtube,onset_in_salami,hashes,total_hashes
LSt9fp9sxZI,1,1,Guns N' Roses - Estranged (Live),593,-0.9347,0,potential,True,True,True,False,4,379.8,0.5,0.5,4444.0,10289.0
id_0_zGvGNE,0,3,It's Alright (Live In Houston / 1992),187,405.0653,0,reject,True,True,False,False,0,,,,,
dpmAY059TTY,0,2,Guns N' Roses - Estranged (Official Music Video),587,5.0653,0,,True,True,False,False,0,,,,,
RK4-eWGI-0I,0,2,"BLACK SABBATH BILL WARD, ESTRANGED, ACCUSES GEEZER OF LYING ABOUT OFFER",55,537.0653,0,,True,True,False,False,0,,,,,
2ghel-NM5fw,2,2,Black Sabbath - Weels Of Confusion HD (Legendado),481,111.0653,0,,True,True,False,False,0,,,,,
4XQQhJC5MiY,4,2,Black Sabbath Paranoid Guitar Cover HQ,40,552.0653,0,,True,True,False,False,0,,,,,
RXg2yY9IRIA,6,2,Guns N' Roses - Estranged - Indiana '91,600,-7.9347,0,,False,True,False,False,0,,,,,
L86nSxxG7ds,6,2,Guns N' Roses - Estranged (Live In Chicago 1992),545,47.0653,0,,False,True,False,False,0,,,,,
cHTcH0Q9hMY,14,2,guns n roses Estranged - Oklahoma 92,565,27.0653,0,,False,False,False,False,0,,,,,
Ozq9Pmh1BZ8,0,1,Estranged (Live),592,0.0653,0,,True,True,False,True,0,,,,,
8VgRL8Htv7k,1,1,Estranged,564,28.0653,0,,True,True,False,False,0,,,,,
kbHQjwyrbZQ,1,1,Bill Ward Slams Black Sabbath Camp for His Absence on Final Shows,65,527.0653,0,,True,True,False,False,0,,,,,
BxpMsRlzLYo,2,1,Guns N' Roses - Estranged Live In Tokyo 1992 HD,634,-41.9347,0,,True,True,False,False,0,,,,,
dn2_3JMUj84,2,1,"BLACK SABBATH, BILL WARD STILL ESTRANGED FOR UPCOMING GIGS",162,430.0653,0,,True,True,False,False,0,,,,,
PUKXVPHGubc,2,1,"Guns N' Roses - ""Estranged"" (En vivo - Audio remasterizado)",527,65.0653,0,,True,True,False,False,0,,,,,
fvSZ0tqWU1s,3,1,Estranged with lyrics - Guns n' Roses,569,23.0653,0,,True,True,False,False,0,,,,,
cwN_1q3jcNg,3,1,BILL WARD - Black Sabbath News,35,557.0653,0,,True,True,False,False,0,,,,,
A1FYdgMZBGc,3,1,Fairies wear boot's Perth Arena 15-04-16,261,331.0653,0,,True,True,False,False,0,,,,,
cxjBYjrNaq4,3,1,Guns N' Roses   Estranged   DVD Live Era Legendado,555,37.0653,0,,True,True,False,False,0,,,,,
N-HDp8N3RJ0,4,1,"Guns N' Roses - Estranged (Download Festival 2018, Donington Park, Castle Donington 9th June 2018)",531,61.0653,0,,True,True,False,False,0,,,,,
Dd8EWuLj2NQ,4,1,"Black Sabbath's Bill Ward on drugs, alcohol, depression & music 2/2",570,22.0653,0,,True,True,False,False,0,,,,,
4au2xjz0FFc,4,1,Estranged - Guns N´ Roses (Live at Tokyo ´92) Subtitulado al español por mí.,625,-32.9347,0,,True,True,False,False,0,,,,,
q-lj8_aD58w,5,1,Guns and Roses   Estranged  Lyric,585,7.0653,0,,False,True,False,False,0,,,,,
z5ca2Y8QJ5I,5,1,Black Sabbath's Rollercoaster Ride (Starring Geezer Butler and Wendy Dio at the Golden Gods),132,460.0653,0,,False,True,False,False,0,,,,,
R9fVM4F60mc,5,1,Black Sabbath Ao Vivo em São Paulo (11.10.2013),1121,-528.9347,0,,False,True,False,False,0,,,,,
gBnVPbzGAt4,6,1,"BLACK SABBATH RESPONDS TO BILL WARD, WILL MOVE ON WITHOUT HIM",163,429.0653,0,,False,True,False,False,0,,,,,
dR0rqdt8nlQ,6,1,Black Sabbath - Paranoid - cover - full song + solo,167,425.0653,0,,False,True,False,False,0,,,,,
G__akPg65PI,7,1,Guns N' Roses   Estranged   Live in Jakarta 2018,545,47.0653,0,,False,True,False,False,0,,,,,
b2_C5UoZY6g,7,1,FGWM Guns N' Roses   Live Era 86   93,12745,-12152.9347,0,,False,True,False,False,0,,,,,
EteIEckrTQE,8,1,Guns N Roses - Estranged live in Abu Dhabi 25th November 2018,536,56.0653,0,,False,True,False,False,0,,,,,
xuwSikmvo8c,8,1,Guns N` Roses Estranged Live Era,537,55.0653,0,,False,True,False,False,0,,,,,
ipeleYE53ds,9,1,Guns n roses - Estranged Firenze 2018,542,50.0653,0,,False,True,False,False,0,,,,,
5HGJp5OGNSM,9,1,"BLACK SABBATH REUNION IN JEOPARDY, BILL WARD SAYS CONTRACT ""UNFAIR""",147,445.0653,0,,False,True,False,False,0,,,,,
oWt_19GCY2c,9,1,Guns N Roses-You Could Be Mine Live Era (87-93),335,257.0653,0,,False,True,False,False,0,,,,,
3SWclm0FeWY,10,1,Guns N Roses Estranged Lyrics,568,24.0653,0,,False,False,False,False,0,,,,,
4ePpzC5HxXw,10,1,A few wise words by Bill Ward of Black Sabbath,60,532.0653,0,,False,False,False,False,0,,,,,
2QTW4JPabNk,11,1,"Guns N’ Roses - Estranged (Göteborg, Ullevi 2018) 4k",539,53.0653,0,,False,False,False,False,0,,,,,
pul3IFiJBbo,11,1,"Bill Ward discusses Vietnam veterans reaction to ""War Pigs"" at early US Black Sabbath shows",56,536.0653,0,,False,False,False,False,0,,,,,
8uR9-qG2QGc,11,1,Guns N' Roses - Estranged (Live In Tokyo 1992/Live Era '87-'93) FULL,545,47.0653,0,,False,False,False,False,0,,,,,
w-NnlOtmZAE,12,1,Guns N Roses Estrange Music Video,565,27.0653,0,,False,False,False,False,0,,,,,
z4ynyuZuz-M,12,1,"BLACK SABBATH: Ozzy vs Bill Ward (Max Cavalera, Iggor Cavalera & Ted Aquilar (DEATH ANGEL) Comment)!",312,280.0653,0,,False,False,False,False,0,,,,,
S_u2LUOqA-A,12,1,WELCOME TO THE JUNGLE LIVE ERA 86-93,322,270.0653,0,,False,False,False,False,0,,,,,
KarztRVpWKw,13,1,Guns N Roses Estranged Subtítulos en Español,565,27.0653,0,,False,False,False,False,0,,,,,
GAZ6dN4JzDI,13,1,Black Sabbath - 'The Best Is Yet To Come',281,311.0653,0,,False,False,False,False,0,,,,,
J6oGU46YJSQ,13,1,Guns N' Roses Live Era '87-'93 Unaltered Performances,5841,-5248.9347,0,,False,False,False,False,0,,,,,
sJjq0LeDpAs,14,1,Black Sabbath's Geezer Butler's Interview on being vegan!,104,488.0653,0,,False,False,False,False,0,,,,,
Bf1ywLaDupU,14,1,Guns N' Roses   Rocket Queen Live Era '87 '93,508,84.0653,0,,False,False,False,False,0,,,,,
SQSRmZ444Wo,15,1,Guns N' Roses Documentary:The True Story Behind Estranged! Most Expensive GNR Music Video!,890,-297.9347,0,,False,False,False,False,0,,,,,
br0kfgpV-HY,15,1,"Bill Ward Pays Respect to Veterans at Press Conference on 11-11-11, Whisky A Go-Go.mp4",55,537.0653,0,,False,False,False,False,0,,,,,
j-vdhilm6-U,16,1,GUNS N' ROSES (PHENOMENAL AXL ROSE VOCALS!) - ESTRANGED - PHILADELPHIA 2016,536,56.0653,0,,False,False,False,False,0,,,,,
4hQrtITOpcI,16,1,"MACHINE HEAD DRUMMER SAYS BLACK SABBATH, BILL WARD DEAL SOUNDS BAD",136,456.0653,0,,False,False,False,False,0,,,,,
dn4VbbaAY38,16,1,GUITAR TRACK: Guns N' Roses - Estranged (Live In Tokyo 1992/Live Era '87-'93),545,47.0653,0,,False,False,False,False,0,,,,,
ZA0yuDSZQCk,17,1,Black Sabbath's New Album & Bill Ward Conspiracy Theories,424,168.0653,0,,False,False,False,False,0,,,,,
vlDr0DeGGPM,17,1,Guns N Roses-14 Years Live Era 87-93,262,330.0653,0,,False,False,False,False,0,,,,,
5THwRqoRvVE,18,1,Guns N' Roses - Estranged (full guitar cover),568,24.0653,0,,False,False,False,False,0,,,,,
XXWziglNbts,18,1,Bill Ward Lifetime Achievement Award,262,330.0653,0,,False,False,False,False,0,,,,,
puYcjyYKhn4,18,1,Guns N' Roses   It's Alright Live Era '87 '93,187,405.0653,0,,False,False,False,False,0,,,,,
gZhu4IITRd0,19,1,Guns N Roses Soundcheck Estranged,531,61.0653,0,,False,False,False,False,0,,,,,
O-QnPTvWcOA,19,1,Guns N'Roses - November Rain (Live Era '87-'93; from Use Your Illusion I),751,-158.9347,0,,False,False,False,False,0,,,,,
