youtube_id,top_rank,n_hits,title,duration,deviation,salami_coverage,decision,in_top_5,in_top_10,same_plus_5,same_less_5,overall_score,matching_length,onset_in_youtube,onset_in_salami,hashes,total_hashes
-RngRJDDEPk,2,3,11 Studies in Noise and Dialectic: No. 4. We Workers Have Strength,53,5.566541666669999,0,potential,True,True,False,False,100,50.2,0.2,0.7,492.0,504.0
4klQEj-lzBg,0,3,We Workers Have the Strength and Power,124,-65.4334583333,0,reject,True,True,False,False,7,,,,,
QYE2lYuxHww,0,2,WE SPEAK LIFE | Official Planetshakers Music Video,443,-384.43345833300003,0,,True,True,False,False,7,,,,,
jZCOkxdlV4Q,1,3,We Workers Are Powerful,107,-48.4334583333,0,,True,True,False,False,2,,,,,
UhIsx0UOVuQ,3,3,We Workers are Powerful,195,-136.433458333,0,,True,True,False,False,2,,,,,
VC8-Sbiy9ps,4,3,We Workers Are Powerful,113,-54.4334583333,0,,True,True,False,False,2,,,,,
B_cwxviBPgw,1,2,Flight Brigade - Where Eagles Dare (Official Video),228,-169.433458333,0,,True,True,False,False,2,,,,,
c2PE3I57GnQ,1,2,Weirdest Ships In The World,403,-344.43345833300003,0,,True,True,False,False,2,,,,,
R0JKCYZ8hng,3,2,How playing an instrument benefits your brain - Anita Collins,285,-226.433458333,0,,True,True,False,False,2,,,,,
K71UbC1EaSE,4,2,"It's The End Of The World As We Know It (And I Feel Fine) - Great Big Sea - Lyrics ,",162,-103.43345833299999,0,,True,True,False,False,2,,,,,
VSzvVXiWkSg,5,3,Shipyard Workers Use Robotic Suit To Have Super Strength,66,-7.433458333330001,0,,False,True,False,False,1,,,,,
HQeX3l1rzug,6,3,We Workers Are Powerful,168,-109.43345833299999,0,,False,True,False,False,1,,,,,
09zY1qfu_CU,7,3,We workers are powerful,182,-123.43345833299999,0,,False,True,False,False,1,,,,,
exCIg8H_LZ4,8,3,We Workers Are Powerful (Zan Men Gong Ren You Li Liang),111,-52.4334583333,0,,False,True,False,False,1,,,,,
fp0StuYviqI,9,3,People Punching BOXING MACHINE (0-999!!),466,-407.43345833300003,0,,False,True,False,False,1,,,,,
Vqrnu1U1xJA,7,2,Cardi B Plans to Take Baby on Tour with Bruno Mars,185,-126.43345833299999,0,,False,True,False,False,1,,,,,
wPflq6u9YWk,8,2,"New York City - Video Tour of SoHo, Manhattan",299,-240.433458333,0,,False,True,False,False,1,,,,,
-GFeRcBImxw,8,1,How Powerful is Poland ? -  Polish Military Power 2018,270,-211.433458333,0,,False,True,False,False,1,,,,,
Wcf5b3mENJU,10,3,STRUGGLE makes you STRONGER - Motivational Video,332,-273.433458333,0,,False,False,False,False,0,,,,,
tJj0mEBnU_o,11,3,CREATIVE WORKERS IN ACTION. YOU’VE NEVER SEEN ANYTHING LIKE THIS BEFORE,601,-542.433458333,0,,False,False,False,False,0,,,,,
494dUevcqJM,12,3,PEOPLE ARE AWESOME (FAST WORKERS EDITION),141,-82.4334583333,0,,False,False,False,False,0,,,,,
SRCmXsdKnlg,13,3,A Song For The Workers (A Union Song) - By The Workers,255,-196.433458333,0,,False,False,False,False,0,,,,,
uyM6Wyg0xPg,14,3,Old Man Strength At Muscle Beach,217,-158.433458333,0,,False,False,False,False,0,,,,,
KyEu8fYplck,15,3,We Workers Are Powerful (Zan Men Gong Ren You Li Liang),111,-52.4334583333,0,,False,False,False,False,0,,,,,
aQsAHhRxwvw,16,3,"Make it Real: Elysium Exoskeleton -- the Big Test, 170LB Barbell Curl (Part 16)",396,-337.433458333,0,,False,False,False,False,0,,,,,
UuXUfx2Mtvs,17,3,ONLY IN JAPAN | Part #1: World's Fastest Things,818,-759.433458333,0,,False,False,False,False,0,,,,,
_ZeUlqJwNmw,18,3,How Much Weight Can a Barbell Hold? | STRENGTH TEST,419,-360.43345833300003,0,,False,False,False,False,0,,,,,
A27QjpQ_Ieo,19,3,Social workers as super-heroes | Anna Scheyett | TEDxColumbiaSC,457,-398.43345833300003,0,,False,False,False,False,0,,,,,
imjq5yQzNiI,5,2,The Netherlands: Beyond Amsterdam,1503,-1444.43345833,0,,False,True,False,False,0,,,,,
PuINlhlOJp8,6,2,"FAMOUS GRAVE TOUR - New York #1 (Lillian Gish, Montgomery Clift, etc.)",1855,-1796.43345833,0,,False,True,False,False,0,,,,,
4DKkueqcKmQ,7,2,How Are Carbon Fibre Bikes Made? | LOOK Cycle Factory Tour,1220,-1161.43345833,0,,False,True,False,False,0,,,,,
uiZqERJqr-g,9,2,Inside Factor Bikes | GCN Tours The Factor HQ,917,-858.433458333,0,,False,True,False,False,0,,,,,
bH8warHfJtI,11,2,"""China Bans Rap, Tattoos And Hip-Hop. Over-Reacting A Bit?""",968,-909.433458333,0,,False,False,False,False,0,,,,,
oUoMRr12oQc,12,2,One Year Later... | Critical Role RPG Episode 95,14735,-14676.4334583,0,,False,False,False,False,0,,,,,
0hTrReApG9I,12,2,,0,inf,0,,False,False,False,False,0,,,,,
byva0hOj8CU,13,2,"Curious Beginnings  | Critical Role | Campaign 2, Episode 1",12272,-12213.433458299998,0,,False,False,False,False,0,,,,,
PwciNb-BZIk,5,1,Hunting For A Rare Congolese Weed Strain With “The Kings of Cannabis” | VICE on HBO,931,-872.433458333,0,,False,True,False,False,0,,,,,
CdolLmN6OSI,10,1,MIRACLES by Sandeep Maheshwari I Hindi,2674,-2615.43345833,0,,False,False,False,False,0,,,,,
eXSCtYAuaA4,14,1,Modeselektor Lecture (Berlin 2018) | Red Bull Music Academy,5262,-5203.43345833,0,,False,False,False,False,0,,,,,
W2_FF1paBew,14,1,How Dolls Are Made | I Didn't Know That,148,-89.4334583333,0,,False,False,False,False,0,,,,,
wpxWoikZZww,16,1,Iron Maiden - Wasted Years (Live from The Book Of Souls World Tour),334,-275.433458333,0,,False,False,False,False,0,,,,,
9LUv3kbmNfg,16,1,Arnold Works at Gold's,149,-90.4334583333,0,,False,False,False,False,0,,,,,
Yv9I-VvF1pg,17,1,"Drones - ""Burnt Stitches"" (A BlankTV Premiere!)",205,-146.433458333,0,,False,False,False,False,0,,,,,
uPj9HYQCaek,18,1,The Strength of Tradition,179,-120.43345833299999,0,,False,False,False,False,0,,,,,
EgBZHIUUn8Q,18,1,"Loop | Susan Rogers on Prince, production and perception",3744,-3685.43345833,0,,False,False,False,False,0,,,,,
